{
  "id": "controlprofile://worldspec/h1-kitchen/whole-body-task-space-spike-v1",
  "profileVersion": "0.1.0",
  "status": "research",
  "stage": "whole_body_task_space_control_spike",
  "seed": 41,
  "baseTrainingProfileDigest": "sha256:6c2002f7fedaae1739416c96e7698b389d8ddc7bedc7386921e141964128eec6",
  "supervisorProfileDigest": "sha256:14912f19403922ccdab5ba9027c8ecd97adcc514ba52035ea1e53e4c8d951355",
  "failedA5RReportDigest": "sha256:c55d67244d28d3abdfef787b7858fceabea61a534fe1beb674fdc3bad7a67da0",
  "motionPolicy": {
    "sourceStage": "loaded-track-settle-transition-v2-failed",
    "sourceReportDigest": "sha256:1d7310274a58e78e21570fe0916c23af49573f41d769037393967d41ce89705d",
    "checkpointDigest": "sha256:2e4590c9291c81581205aee02c4bf168b9532790a14aecac839faee68954d356",
    "checkpointSizeBytes": 8838595,
    "distribution": "internal_only",
    "selectedRole": "motion"
  },
  "capturePolicy": {
    "sourceStage": "loaded-track-settle-capture-v1-passed",
    "sourceReportDigest": "sha256:8261f863d71cb66de46facb37b3c5ed121811e80fdabac057629ed366a52666f",
    "checkpointDigest": "sha256:7f8c45e7c0bf1d485706ca694c44e74bfd351ab4f753bfacff947e9f7e75cfbe",
    "checkpointSizeBytes": 6280278,
    "distribution": "internal_only",
    "selectedRole": "motion_state_capture"
  },
  "standPolicy": {
    "sourceStage": "stand-v2.1",
    "sourceReportDigest": "sha256:8a92a910ca52540fff50bab37e20e7e28d4ea06ae0acd20d0079e8b45e65f660",
    "checkpointDigest": "sha256:fc91edb936de7391b7e075596e5aaa944acc656664cdb820dbb21c149cf7921c",
    "checkpointSizeBytes": 6280684,
    "distribution": "internal_only",
    "selectedRole": "zero_velocity_and_stand"
  },
  "scene": {
    "sceneId": "scene://worldspec/h1-kitchen/primitive-drawer-cup-v2",
    "evidenceStatus": "generated",
    "distribution": "internal_only",
    "drawer": {
      "closedCenter": [2.06, -0.21, 1.02],
      "slideAxis": [-1.0, 0.0, 0.0],
      "range": [0.0, 0.24],
      "openThreshold": 0.18,
      "closedThreshold": 0.03
    },
    "cup": {
      "initialCenter": [1.88, -0.21, 1.195],
      "proxy": "short_cylinder",
      "massKg": 0.18
    },
    "support": {
      "type": "fixed_box",
      "center": [1.88, -0.21, 1.155],
      "halfSize": [0.1, 0.09, 0.015]
    },
    "graspModel": "physical_contact_only",
    "hiddenAttachment": false
  },
  "controller": {
    "mode": "hierarchical_box_qp_with_inverse_dynamics_feedforward",
    "decisionVariables": [
      "base_velocity_x",
      "base_velocity_y",
      "base_yaw_rate",
      "torso_velocity",
      "right_shoulder_pitch_velocity",
      "right_shoulder_roll_velocity",
      "right_shoulder_yaw_velocity",
      "right_elbow_velocity"
    ],
    "controlledJoints": [
      "torso",
      "right_shoulder_pitch",
      "right_shoulder_roll",
      "right_shoulder_yaw",
      "right_elbow"
    ],
    "qpIterations": 48,
    "cartesianGain": 4.0,
    "maximumCartesianSpeed": 0.35,
    "velocityLowerBounds": [-0.08, -0.06, -0.15, -0.5, -0.8, -0.8, -0.8, -0.8],
    "velocityUpperBounds": [0.08, 0.06, 0.15, 0.5, 0.8, 0.8, 0.8, 0.8],
    "regularization": [2.0, 2.0, 3.0, 0.35, 0.15, 0.15, 0.15, 0.15],
    "targetHorizonSeconds": 0.4,
    "maximumJointTargetStep": 0.3,
    "jointLimitMarginRadians": 0.05,
    "feedforwardScale": 1.0,
    "feedforwardControlReserve": 0.2
  },
  "qualityGates": {
    "settleSteps": 25,
    "trackingSteps": 180,
    "positionToleranceMeters": 0.035,
    "holdSteps": 20,
    "maximumTcpSpeed": 0.15,
    "maximumBaseTranslation": 0.2,
    "maximumBaseLateralDrift": 0.12,
    "minimumBaseHeight": 0.8,
    "minimumUprightCosine": 0.8,
    "maximumProjectedGradient": 0.00001,
    "maximumNonFiniteSamples": 0
  },
  "runtime": {
    "containerImage": "ccr-29eug8s3-pub.cnc.bj.baidubce.com/dataflow-poc/worldspec-h1-training@sha256:684dafef489c9192982912a6e2ffea3e4a50936ec1ccb0930bd67af55039f94c",
    "containerDigest": "sha256:684dafef489c9192982912a6e2ffea3e4a50936ec1ccb0930bd67af55039f94c",
    "packageLockDigest": "sha256:7cc88f20b2c608d6fe673f3b994b879db69d75361206bf25f949d7acc5ed3a41",
    "ccdIterations": 50,
    "evaluationEnvironments": 1,
    "mjxCapacity": {
      "activeContactsPerEnvironment": 32,
      "ccdContactsPerEnvironment": 16,
      "njmax": 128
    }
  },
  "artifactPolicy": {
    "controller": "research_only",
    "distribution": "internal_only",
    "fullTaskClaim": "forbidden",
    "l3Claim": "forbidden"
  }
}
